{
  "schema_version": "1.0.0",
  "canonical_source": ".agents/skills/registry.md",
  "derived_artifact": true,
  "generated_by": "scripts/sync-skill-registry.mjs",
  "skills": [
    {
      "name": "workflow-router",
      "class": "Workflow",
      "path": ".agents/skills/00-router/workflow-router/SKILL.md",
      "trigger": "Per-turn intake selects non-trivial, iterative, implementation-adjacent, or multi-step freeform work without an explicit skill, and provides explicit route options when user choice is required",
      "loading_posture": "Startup-minimal",
      "cost_hint": "lean",
      "key": "workflow-router",
      "runtime_notes": "Intake runs every prompt; load the full skill for non-trivial, iterative, implementation-adjacent, or multi-step routing, including user-choice menus (for example `project-formation` vs `create-prd`)."
    },
    {
      "name": "create-epic",
      "class": "Workflow",
      "path": ".agents/skills/01-product/create-epic/SKILL.md",
      "trigger": "Large initiative needing research, appetite, phases, or multiple PRDs",
      "loading_posture": "Explicit-only",
      "cost_hint": "balanced",
      "key": "create-epic",
      "runtime_notes": "Use before PRD queue creation."
    },
    {
      "name": "create-prd",
      "class": "Workflow",
      "path": ".agents/skills/01-product/create-prd/SKILL.md",
      "trigger": "Feature/ticket/spec needs formal PRD before implementation",
      "loading_posture": "Explicit-only",
      "cost_hint": "balanced",
      "key": "create-prd",
      "runtime_notes": "Expected predecessor to `implement-prd`."
    },
    {
      "name": "generate-pm-ticket",
      "class": "Workflow",
      "path": ".agents/skills/01-product/generate-pm-ticket/SKILL.md",
      "trigger": "User needs a backlog/Jira-style ticket rather than full PRD",
      "loading_posture": "Explicit-only",
      "cost_hint": "lean",
      "key": "generate-pm-ticket",
      "runtime_notes": "Smaller planning artifact than PRD."
    },
    {
      "name": "project-formation",
      "class": "Workflow",
      "path": ".agents/skills/01-product/project-formation/SKILL.md",
      "trigger": "PM needs end-to-end project shaping from discovery through GTM and dossier handoff",
      "loading_posture": "Explicit-only",
      "cost_hint": "balanced",
      "key": "project-formation",
      "runtime_notes": "Clean-room product workflow for project formation without external copied content."
    },
    {
      "name": "solution-sketch",
      "class": "Workflow",
      "path": ".agents/skills/01-product/solution-sketch/SKILL.md",
      "trigger": "User asks to compare solution shapes, classes, or architecture before writing a PRD or epic",
      "loading_posture": "Explicit-only",
      "cost_hint": "lean",
      "key": "solution-sketch",
      "runtime_notes": "Offer-only sister skill; never auto-start; writes `docs/design/<slug>-sketch.md`."
    },
    {
      "name": "project-formation-router",
      "class": "Delegate-only implementation",
      "path": ".agents/skills/01-product/project-formation/router/SKILL.md",
      "trigger": "`project-formation` needs per-turn internal stage routing and anti-skip gating",
      "loading_posture": "Delegated-only",
      "cost_hint": "lean",
      "key": "project-formation-router",
      "runtime_notes": "Owned by `project-formation`."
    },
    {
      "name": "project-formation-discovery",
      "class": "Delegate-only implementation",
      "path": ".agents/skills/01-product/project-formation/discovery/SKILL.md",
      "trigger": "`project-formation` needs user/stakeholder discovery and question design",
      "loading_posture": "Delegated-only",
      "cost_hint": "lean",
      "key": "project-formation-discovery",
      "runtime_notes": "Owned by `project-formation`."
    },
    {
      "name": "project-formation-shaping",
      "class": "Delegate-only implementation",
      "path": ".agents/skills/01-product/project-formation/shaping/SKILL.md",
      "trigger": "`project-formation` needs appetite-based shaping and tradeoff decisions",
      "loading_posture": "Delegated-only",
      "cost_hint": "balanced",
      "key": "project-formation-shaping",
      "runtime_notes": "Owned by `project-formation`."
    },
    {
      "name": "project-formation-roadmap",
      "class": "Delegate-only implementation",
      "path": ".agents/skills/01-product/project-formation/roadmap/SKILL.md",
      "trigger": "`project-formation` needs phased sequencing, dependencies, and risk gating",
      "loading_posture": "Delegated-only",
      "cost_hint": "balanced",
      "key": "project-formation-roadmap",
      "runtime_notes": "Owned by `project-formation`."
    },
    {
      "name": "project-formation-gtm",
      "class": "Delegate-only implementation",
      "path": ".agents/skills/01-product/project-formation/gtm/SKILL.md",
      "trigger": "`project-formation` needs go-to-market planning and KPI framing",
      "loading_posture": "Delegated-only",
      "cost_hint": "balanced",
      "key": "project-formation-gtm",
      "runtime_notes": "Owned by `project-formation`."
    },
    {
      "name": "project-formation-dossier",
      "class": "Delegate-only implementation",
      "path": ".agents/skills/01-product/project-formation/dossier/SKILL.md",
      "trigger": "`project-formation` needs complete project dossier assembly for execution handoff",
      "loading_posture": "Delegated-only",
      "cost_hint": "lean",
      "key": "project-formation-dossier",
      "runtime_notes": "Owned by `project-formation`."
    },
    {
      "name": "implement-prd",
      "class": "Workflow",
      "path": ".agents/skills/02-implement/implement-prd/SKILL.md",
      "trigger": "Approved PRD needs implementation",
      "loading_posture": "Explicit-only",
      "cost_hint": "balanced",
      "key": "implement-prd",
      "runtime_notes": "Orchestrator for delegate-only implementation skills."
    },
    {
      "name": "prd-readiness-review",
      "class": "Delegate-only implementation",
      "path": ".agents/skills/02-implement/prd-readiness-review/SKILL.md",
      "trigger": "`implement-prd` needs readiness/go-stop review",
      "loading_posture": "Delegated-only",
      "cost_hint": "lean",
      "key": "prd-readiness-review",
      "runtime_notes": "Owned by `implement-prd`."
    },
    {
      "name": "codebase-discovery",
      "class": "Delegate-only implementation",
      "path": ".agents/skills/02-implement/codebase-discovery/SKILL.md",
      "trigger": "`implement-prd` needs targeted codebase discovery",
      "loading_posture": "Delegated-only",
      "cost_hint": "balanced",
      "key": "codebase-discovery",
      "runtime_notes": "Owned by `implement-prd`."
    },
    {
      "name": "implementation-slicing",
      "class": "Delegate-only implementation",
      "path": ".agents/skills/02-implement/implementation-slicing/SKILL.md",
      "trigger": "`implement-prd` needs executable slice plan",
      "loading_posture": "Delegated-only",
      "cost_hint": "balanced",
      "key": "implementation-slicing",
      "runtime_notes": "Owned by `implement-prd`."
    },
    {
      "name": "implementation-skill-matcher",
      "class": "Delegate-only implementation",
      "path": ".agents/skills/02-implement/implementation-skill-matcher/SKILL.md",
      "trigger": "`implement-prd` needs slice-to-pattern-skill matching after slicing and before coding",
      "loading_posture": "Delegated-only",
      "cost_hint": "balanced",
      "key": "implementation-skill-matcher",
      "runtime_notes": "Owned by `implement-prd`; classifies reusable knowledge/capabilities without changing slice ownership."
    },
    {
      "name": "backend-phase-implementer",
      "class": "Delegate-only implementation",
      "path": ".agents/skills/02-implement/backend-phase-implementer/SKILL.md",
      "trigger": "Backend slice assigned by implementation plan",
      "loading_posture": "Delegated-only",
      "cost_hint": "balanced",
      "key": "backend-phase-implementer",
      "runtime_notes": "Owned by `implement-prd`; writes assigned backend files only."
    },
    {
      "name": "frontend-phase-implementer",
      "class": "Delegate-only implementation",
      "path": ".agents/skills/02-implement/frontend-phase-implementer/SKILL.md",
      "trigger": "Frontend slice assigned by implementation plan",
      "loading_posture": "Delegated-only",
      "cost_hint": "balanced",
      "key": "frontend-phase-implementer",
      "runtime_notes": "Owned by `implement-prd`; writes assigned frontend files only."
    },
    {
      "name": "acceptance-test-engineer",
      "class": "Delegate-only implementation",
      "path": ".agents/skills/02-implement/acceptance-test-engineer/SKILL.md",
      "trigger": "Acceptance criteria require focused tests",
      "loading_posture": "Delegated-only",
      "cost_hint": "lean",
      "key": "acceptance-test-engineer",
      "runtime_notes": "Owned by `implement-prd`."
    },
    {
      "name": "contract-verifier",
      "class": "Quality/validation",
      "path": ".agents/skills/02-implement/contract-verifier/SKILL.md",
      "trigger": "Backend response feeds frontend or API contract changes",
      "loading_posture": "Just-in-time",
      "cost_hint": "lean",
      "key": "contract-verifier",
      "runtime_notes": "Bridges quality validation and standards/pattern procedure."
    },
    {
      "name": "validation-runner",
      "class": "Delegate-only implementation",
      "path": ".agents/skills/02-implement/validation-runner/SKILL.md",
      "trigger": "`implement-prd` needs focused validation/failure triage",
      "loading_posture": "Delegated-only",
      "cost_hint": "lean",
      "key": "validation-runner",
      "runtime_notes": "Owned by `implement-prd`."
    },
    {
      "name": "qa-handoff-review",
      "class": "Delegate-only implementation",
      "path": ".agents/skills/02-implement/qa-handoff-review/SKILL.md",